{
  "$schema": "https://json-schema.org/draft/2020-12/schema",
  "$id": "https://example.local/schemas/project-state-1.2.0.json",
  "title": "Project State and Artifact Validity",
  "type": "object",
  "additionalProperties": false,
  "required": ["schema_family", "schema_version", "project_id", "state", "current_gate", "updated_at", "readiness", "artifacts"],
  "properties": {
    "$schema": {
      "type": "string"
    },
    "schema_family": {
      "const": "project-state"
    },
    "schema_version": {
      "type": "string",
      "pattern": "^[0-9]+\\.[0-9]+\\.[0-9]+$"
    },
    "project_id": {
      "type": "string",
      "pattern": "^PRJ-[0-9]{3,}$"
    },
    "state": {
      "enum": [
        "INITIALIZED",
        "COMPATIBILITY_VALIDATED",
        "VARIATION_APPROVED",
        "STORY_DESIGNED",
        "CASE_DEFINED",
        "CHARACTERS_DESIGNED",
        "MYSTERY_DESIGNED",
        "STORY_STRUCTURED",
        "SCENES_DESIGNED",
        "SCRIPT_WRITTEN",
        "QA_PASSED",
        "EDITORIAL_REVIEW_REQUIRED",
        "EDITORIAL_APPROVED",
        "PRODUCTION_READY",
        "PRESENTATION_MIGRATION_REQUIRED",
        "BLOCKED"
      ]
    },
    "current_gate": {
      "type": "string",
      "pattern": "^(NONE|GATE-(0[0-9]|1[0-3]))$"
    },
    "updated_at": {
      "type": "string",
      "format": "date-time"
    },
    "readiness": {
      "type": "object",
      "additionalProperties": false,
      "required": ["artifact_status", "contract_status", "process_status", "editorial_status", "process_start_gate", "process_revision"],
      "properties": {
        "artifact_status": {
          "enum": ["INCOMPLETE", "ARTIFACT_COMPLETE"]
        },
        "contract_status": {
          "enum": ["UNVALIDATED", "CONTRACT_VALIDATED"]
        },
        "process_status": {
          "enum": ["NONCONFORMANT", "PROCESS_CONFORMANT"]
        },
        "editorial_status": {
          "enum": ["NOT_REVIEWED", "EDITORIAL_REVIEW_REQUIRED", "EDITORIAL_APPROVED"]
        },
        "process_start_gate": {
          "type": "string",
          "pattern": "^GATE-(0[0-9]|1[0-3])$"
        },
        "process_revision": {
          "type": "integer",
          "minimum": 1
        }
      }
    },
    "revision_trigger": {
      "$ref": "#/$defs/revisionTrigger"
    },
    "artifacts": {
      "type": "object",
      "propertyNames": {
        "pattern": "^[a-z][a-z0-9_]*$"
      },
      "additionalProperties": {
        "type": "object",
        "additionalProperties": false,
        "required": ["status", "content_hash", "invalidated_by"],
        "properties": {
          "status": {
            "enum": ["CLEAN", "DIRTY", "INVALID", "MISSING"]
          },
          "content_hash": {
            "type": ["string", "null"],
            "pattern": "^[a-f0-9]{64}$"
          },
          "invalidated_by": {
            "type": "array",
            "uniqueItems": true,
            "items": {
              "type": "string",
              "pattern": "^[a-z][a-z0-9_]*$"
            }
          }
        }
      }
    }
  },
  "$defs": {
    "revisionTrigger": {
      "type": "object",
      "additionalProperties": false,
      "required": [
        "type",
        "source_id",
        "target_owner_agent",
        "target_gate",
        "target_task_ids",
        "actor",
        "reason",
        "triggered_at"
      ],
      "properties": {
        "type": {
          "enum": [
            "CONFIG_ADMISSION",
            "OWNER_RETURN",
            "HUMAN_REVISION_REQUEST",
            "SEMANTIC_CORRECTION",
            "NORMAL_GATE_PROGRESS"
          ]
        },
        "source_id": {
          "type": "string",
          "minLength": 1
        },
        "target_owner_agent": {
          "type": ["string", "null"],
          "pattern": "^[a-z][a-z0-9_]*$"
        },
        "target_gate": {
          "type": ["string", "null"],
          "pattern": "^GATE-(0[0-9]|1[0-3])$"
        },
        "target_task_ids": {
          "type": "array",
          "uniqueItems": true,
          "items": {
            "type": "string",
            "minLength": 1
          }
        },
        "actor": {
          "type": ["string", "null"],
          "minLength": 1
        },
        "reason": {
          "type": "string",
          "minLength": 1
        },
        "triggered_at": {
          "type": "string",
          "format": "date-time"
        },
        "returned_at": {
          "type": "string",
          "format": "date-time"
        }
      }
    }
  }
}
